
(服务端)10.12.212.23 本机ip
(客户端)10.12.212.46 本机上虚拟机ip
 成功建立连接后感觉窗口大小有点怪,每次传输的数据大小怎么可能比两端通告窗口大呢？
# tcpdump tcp port 8989

tcpdump: verbose output suppressed, use -v or -vv for full protocol decode
listening on eth0, link-type EN10MB (Ethernet), capture size 65535 bytes
02:47:03.481181 IP 10.12.212.46.33108 > 10.12.212.23.sunwebadmins: Flags [S], seq 2476101790, win 14600, options [mss 1460,sackOK,TS val 32285919 ecr 0,nop,wscale 6], length 0
02:47:03.481501 IP 10.12.212.23.sunwebadmins > 10.12.212.46.33108: Flags [S.], seq 2808119227, ack 2476101791, win 8192, options [mss 1460,nop,wscale 8,sackOK,TS val 3570724 ecr 32285919], length 0
02:47:03.481538 IP 10.12.212.46.33108 > 10.12.212.23.sunwebadmins: Flags [.], ack 1, win 229, options [nop,nop,TS val 32285919 ecr 3570724], length 0
02:47:17.270839 IP 10.12.212.46.33108 > 10.12.212.23.sunwebadmins: Flags [P.], seq 1:696, ack 1, win 229, options [nop,nop,TS val 32299709 ecr 3570724], length 695
02:47:17.470783 IP 10.12.212.23.sunwebadmins > 10.12.212.46.33108: Flags [.], ack 696, win 260, options [nop,nop,TS val 3572122 ecr 32299709], length 0
02:47:53.170311 IP 10.12.212.46.33108 > 10.12.212.23.sunwebadmins: Flags [P.], seq 696:1391, ack 1, win 229, options [nop,nop,TS val 32335608 ecr 3572122], length 695
02:47:53.370297 IP 10.12.212.23.sunwebadmins > 10.12.212.46.33108: Flags [.], ack 1391, win 257, options [nop,nop,TS val 3575712 ecr 32335608], length 0
02:48:33.291148 IP 10.12.212.46.33108 > 10.12.212.23.sunwebadmins: Flags [.], seq 1391:2839, ack 1, win 229, options [nop,nop,TS val 32375729 ecr 3575712], length 1448
02:48:33.291302 IP 10.12.212.46.33108 > 10.12.212.23.sunwebadmins: Flags [P.], seq 2839:3472, ack 1, win 229, options [nop,nop,TS val 32375729 ecr 3575712], length 633
02:48:33.291554 IP 10.12.212.23.sunwebadmins > 10.12.212.46.33108: Flags [.], ack 3472, win 260, options [nop,nop,TS val 3579704 ecr 32375729], length 0
